,content,essay_label_id,Daily_life,Health_and_lifestyle,Selfawareness_and_Improvement,Language_Learning,Career_planning,Communication,Literature,Art,Sports,Traditional_custom,Hot_topic,History_Politics_Culture,Social_Progress_and_Human_Civilization,Technology_and_Invention,National_Geography,Natural_Environment_and_Heritage_Protection,Human_Environment_Animals_Plants,Human_Society_and_Environment,Cultural_heritage
298,"   T   ennis   P   layer      Li Na is the first player from Asia elected   ①  to the International Tennis Hall of Fame.   She joins Mary Pierce and Yevgeny Kafelnikov in the Class of 2019, which was announced    ②   Monday at the Australian Open.  All three players won a pair of Grand Slam singles titles — one at Melbourne Park and the other at Roland Garros.  Li retired in 2014 at age 32 because of recurring   ③  knee injuries.   She won the 2011 French Open and 2014 Australian Open, making her the first tennis player born in Asia to collect a major singles title and helping grow the sport in her native China.  Kafelnikov won the 1996 French Open and 1999 Australian Open, while Pierce was the champion   ④  at the 1995 Australian Open and 2000 French Open.  The induction ceremony   ⑤  is July 20 at the hall in Newport, Rhode Island.","['0', '0', '0', '0', '0', '0', '0', '0', '1', '0', '1', '0', '0', '0', '0', '0', '0', '0', '0']",0,0,0,0,0,0,0,0,1,0,1,0,0,0,0,0,0,0,0
299,"  Cultivating a Hobby      To be really happy really safe, one ought to have at least two or three hobbies, and they must all be real. It is no use starting late in life to say: “I will take an interest in this or that.” Such an attempt only aggravates   ①  the strain   ②  of mental effort.   A man may acquire great knowledge of topics unconnected with his daily work, and yet hardly get any benefit or relief    ③   . It is no use do   i   ng what you like; you have got to like what you do.  Broadly speaking, human beings may be divided into three classes; those who are toiled to death, those who are worried to death, and those who are bored to death. It is no use offering the manual laborer, tired out with a hard week’s sweat and effort, the chance of playing a game of football or baseball on Saturday afternoon. It is no use inviting the politician or the professional or businessman, who has been working or worrying about serious things for six days, to work or worry about trifling   ④  things at the week-end.   It may also be said that rational    ⑤   , industrious    ⑥   , useful human beings are dividing into two classes: first, those whose work is work and whose pleasure is pleasure; and secondly, those whose work and pleasure are one.  Of these the former is majority. They have their compensations   ⑦  . The long hours in the office or the factory bring with them as their reward, not only the means of sustenance   ⑧  , but a keen   ⑨  appetite for pleasure even in its simplest and most modest forms. But Fortune’s favored children belong to the second class. Their life is a natural harmony   ⑩  . For them the working hours are never long enough. Each day is a holiday, and ordinary holidays when they come are grudged as enforced interruptions in an absorbing vocation. Yet to both classes the need of an alternative outlook, of a change of atmosphere, of a diversion of effort, is essential. Indeed, it may well be that those whose work is their pleasure are those who most need the means of banishing it at intervals from their minds.","['1', '1', '0', '0', '1', '0', '0', '0', '0', '0', '0', '0', '0', '0', '0', '0', '1', '1', '0']",1,1,0,0,1,0,0,0,0,0,0,0,0,0,0,0,1,1,0
300,"   Becoming Indispensable      Whether you are an employee or the head of your own company,going the extra mile makes you indispensable   ①  to others.You do for them what no one else does.   There may be others with more knowledge,skill,or prestige    ②   ,but you are the only one who provides something absolutely necessary.T  here may be seven other companies providing public relations expertise   ③  ,but if you are the one who can be called upon at two in the morning with a can-do attitude when a disaster strikes,people will remember and value that.  One young man,working for a movie talent agency,was the only person willing to listen to a cantankerous   ④  star complain about   ⑤  her problems hour after hour,day after day.No one else took the time.When she threw a tantrum   ⑥  on the set studio,or her agent,was the only one to persuade her to go back to work.The movie went back on schedule,and millions of dollars were saved.He had made himself indispensable by befriending   ⑦  that important client   ⑧  .  You will never command more than average compensation   ⑨  until you become indispensable to somebody or some group.   Make yourself so useful that it would be extremely difficult,if not impossible,to replace you.People who have pulled themselves out of the crowd and have included the priceless ingredients of going the extra mile and personal initiative    ⑩   in their service virtually write their own paychecks.","['0', '0', '1', '0', '1', '1', '0', '0', '0', '0', '0', '0', '1', '0', '0', '0', '1', '1', '0']",0,0,1,0,1,1,0,0,0,0,0,0,1,0,0,0,1,1,0
301,"   Attending to Little Things       The little kindnesses and courtesies    ①   are so important.Small   discourtesies,little unkindnesses,little forms of disrespect make large withdrawals    ②   .In relationships,the little things are the big things.  I remember an evening I spent with two of my sons some years ago.It was an organized father-and-son outing,complete with gymnastics,wrestling   ③  matches,hot dogs,orangeade,and a movie--the works.  In the middle of the movie,Sean,who was then four years old,fell asleep in his seat.His older brother,Stephen,who was six,stayed awake,and we watched the rest of the movie together.When it was over,I picked Sean up in my arms,carried him out to the car and laid him in the back seat.It was very cold that night,so I took off my coat and gently arranged it over and around him.When we arrived home,I quickly carried Sean in and tucked   ④  him into bed.After Stephen put on his""jammies""and brushed his teeth,I lay down next to him to talk about the night out together.  There wasn't much response   ⑤  on his part.I found myself making conversation.I wondered   ⑥  why Stephen wouldn't open up more.He usually did when exciting things happened.I was a little disappointed   ⑦  .I sensed something was wrong;he had been so quiet on the way home and getting  ready for bed.Suddenly Stephen turned over on his side,facing the wall.I wondered why and lifted myself up just enough to see his eyes welling up   ⑧  with tears.  ""What's wrong,honey?What is it?""  He turned back,and I could sense he was feeling some embarrassment for the tears and his quivering   ⑨  lips and chin.  ""Daddy,if I were cold,would you put your coat around me too?""  Of all the events of that special night out together,the most important was a little act of kindness–a momentary   ⑩  ,unconscious showing of love to his little brother.   What a powerful,personal lesson that experience was to me then and is even now.People are very tender,very sensitive inside.I don't believe age or experience makes much difference.Inside,even within the most toughened and calloused exteriors,are the tender feelings and emotions of the heart.","['0', '0', '1', '0', '0', '1', '0', '0', '0', '0', '0', '0', '0', '0', '0', '0', '1', '1', '0']",0,0,1,0,0,1,0,0,0,0,0,0,0,0,0,0,1,1,0
302,"  A  ll-you-can-eat  S  ushi  R  estaurant      A German triathlete   ①  was banned from an all-you-can-eat sushi restaurant after eating nearly 100 plates of fish. Jaroslav Bobrowski, an Ironman competitor   ②  , visited Running Sushi in Landshut, Bavaria last weekend for a never-ending meal.  According to The Local, Bobrowski went to the restaurant and paid his 15.90 euros ($18.49) for the buffet.  When I went to the checkout, I wanted to tip, but the waiter did not want to accept that, Bobrowski said to The Local.  The former bodybuilder sat down at a table and started eating —and did not stop until he had consumed   ③  nearly 100 plates of sushi.  “He eats for five people. That is not normal,” the restaurant owner told the Passauer Neue Presse.  Bobrowski, who works as a software engineer by day, follows an extreme   ④  diet where he does not eat for 20 hours and then eats “until I’m full,” The Local reported.  The “until I’m full” part is apparently   ⑤  what drove the restaurant to ban the athlete.  The owner told Bobrowski personally that he was no longer allowed to eat there because of his costly habits.  “I’m banned from now on because I’m eating too much,” Bobrowski told the Local.  “I was stunned   ⑥  ,” he added, before saying he had been a regular at Running Sushi.","['1', '1', '1', '0', '0', '0', '0', '0', '0', '1', '1', '0', '0', '0', '0', '0', '0', '0', '0']",1,1,1,0,0,0,0,0,0,1,1,0,0,0,0,0,0,0,0
303,"  The Meaning and Function of Color      Why is pink or purple a color for girls and blue or brown for boys?  The answer depends largely on cultural values as well as personal experiences. To the Egyptians, green was a color that represented   ①  the hope and joy of spring, while for Muslims, it means heaven. Red is a symbol   ②  of good luck in many cultures. In China, children are given money in a red envelope   ③  to bring good fortune in the New Year. For many nations, blue is a symbol of protection and religious beliefs. Greek people often wear a blue necklace hoping to protect themselves against evils.  People’s choice of colors is also influenced by their bodies’ reactions toward them. Green is said to be the most restful color. It has the ability to reduce pain and relax people both mentally and physically.   People who work in green environment have been found to have fewer stomach aches    ④   .  Red can cause a person’s blood pressure to rise and increase people’s appetites   ⑤  . Many decorators   ⑥  will include different shades of red in the restaurant. Similarly, many commercial websites will have a red   ＂   Buy Now   ＂   button because red is a color that easily catches a person’s eye.  Blue is another calming color. Unlike red, blue can cause people to lose appetite. So if you want to eat less, some suggest that eating from blue plates can help.   The next time you are deciding on what to wear or what color to decorate your room, think about the color carefully.","['0', '0', '0', '0', '0', '0', '0', '0', '0', '0', '1', '0', '0', '1', '0', '0', '0', '0', '0']",0,0,0,0,0,0,0,0,0,0,1,0,0,1,0,0,0,0,0
304,"  The colorful honey      Blue and green honey may look cool, but beekeepers in northeastern France are not happy about their strange-looking new product.   Over the past few months, beekeepers in Ribeauvillé, a town located in the Alsace region, have noticed that bees there have been making honey in many strange colors.  Bees have been returning to apiaries   ①  with different colors coating their bodies. The colors then end up polluting the honey.  A recent research showed that a nearby M&amp;M’s factory is behind the change in color. Waste from the factory has been exposing the bees to a number of chemicals   ②  . Some of the chemicals are used in the outer shells of the candies, which come in many bright colors.  The local beekeepers do not know if the polluted honey is dangerous to eat, but they are not taking any chances. They are throwing away the candy-colored honey, which means a big loss to local businesses.  “For me, it’s not honey,” Alain Frieh, leader of the town’s beekeepers union, tells the Reuters news agency. “It’s not sellable.”  The honey industry in this part of France has been suffering this year.   According to Frieh, many bees died last winter or were unable to make honey because of the bad weather.  This new problem of colored honey is hurting the beekeepers’ way of life even more.  The region   ③  is home to about 2,400 beekeepers and 35,000 colonies of bees, according to Alsace’s chamber   ④  of agriculture. The beekeepers harvest approximately 1,000 tons of honey each year, making the product a big part of the region’s economy.  Agrivalor is the company that processes the M&amp;M's factory's waste. According to co-manager Philippe Meinrad, the company has been  attempting to stop the pollution.  “We discovered the problem at the same time they did,” Meinrad tells Reuters. “We quickly put in place a procedure   ⑤  to stop it.”","['0', '0', '0', '0', '0', '0', '0', '0', '0', '0', '1', '0', '0', '1', '0', '1', '0', '1', '0']",0,0,0,0,0,0,0,0,0,0,1,0,0,1,0,1,0,1,0
305,"  Building houses for poor people using 3D printing technology       Having a roof over your head is a basic human need, but there are 1.2 billion people in the world without adequate    ①   housing.  This may change thanks to a revolutionary, low-cost use of 3D printers to construct   ②  houses. With 3D printing, materials are joined together or reinforced   ③  by using a computer-controlled device to create a three-dimensional   ④  object. Two companies have joined forces to try and ease   ⑤  homelessness around the world by building affordable homes using 3D printing. Tech company ICON has developed a method for printing a one-floor, 60-square-meter house out of cement   ⑥  in a day for just $10,000. This is a fraction   ⑦  of both the time and cost needed to build a similar construction using conventional methods.  ICON has teamed up with the non-profit, international housing organization New Story. Together, they will start building homes in developing countries. Their joint venture   ⑧  will see 100 new homes constructed in El Salvador next year.   New Story's co-founder Alexandria Lafci acknowledged that the 100 homes were just a drop in the ocean.  She said: ""There are over 100 million people living in slum   ⑨  conditions, in what we call survival mode."" She also saw possibilities for 3D-printed houses to become common in richer countries in years to come. However, she said that for the moment: ""The tech is ready now to print very high-quality, safe homes in the places we're building.""","['1', '0', '0', '0', '0', '0', '0', '0', '0', '0', '1', '0', '0', '1', '0', '0', '0', '0', '0']",1,0,0,0,0,0,0,0,0,0,1,0,0,1,0,0,0,0,0
306,"  E  xpedition      Larry was on another of his underwater expeditions (   探险   ) but this time, it was different. He decided to take his daughter along with him. She was only ten years old.   This would be her first trip with her father on what he had always been famous for.  Larry first began diving when he was his daughter’s age. Similarly, his father had taken him along on one of his expeditions. Since then, he had never looked back. Larry started out by renting diving suits from the small diving shop just along the shore. He had hated them. They were either too big or too small. Then, there was the instructor   ①  . He gave him a short lesson before allowing him into the water with his father. He had made an exception. Larry would never have been able to go down without at least five hours of theory and another similar number of hours on practical lessons with a guide. Children his age were not even allowed to dive.  After the first expedition, Larry’s later diving adventures   ②  only got better and better. There was never a dull moment. In his black and blue suit and with an oxygen tank   ③  fastened   ④  on his back, Larry dived from boats into the middle of the ocean. Dangerous areas did not prevent him from continuing his search. Sometimes, he was limited to a cage underwater but that did not bother him. At least, he was still able to take photographs of the underwater creatures   ⑤  .  Larry’s first expedition without his father was in the Cayman Islands. There were numerous   ⑥  diving spots in the area and Larry was determined to visit all of them. Fortunately for him, a man offered to take him around the different spots for free.   Larry didn’t even know what the time was, how many spots he dived into or how many photographs he had taken.  The diving spots afforded such a wide array of fish and sea creatures that Larry saw more than thirty varieties of creatures.  Larry looked at his daughter. She looked as excited as he had been when he was her age. He hoped she would be able to continue the family tradition. Already, she looked like she was much braver than had been then. This was the key to a successful underwater expedition.","['1', '0', '0', '0', '0', '1', '0', '0', '0', '0', '0', '0', '0', '0', '0', '0', '0', '0', '0']",1,0,0,0,0,1,0,0,0,0,0,0,0,0,0,0,0,0,0
307,"  I don't agree with you, but I respect you       With the years gone by,I have found that more and more people that I met have different views from mine.  Sometimes I couldn't even use the word""different""to describe this,because our views were almost conflicting   ①  .   In the past,I used to tend to argue with people like this.I always wanted to persuade    ②   them all and make them accept my view while admitting    ③   that they themselves were wrong.  But as time passed by I gradually came to realize that what I had been doing might be not right.  Every person has different experience.And our views are extracted   ④  from our own experiences.  There are too much subjective   ⑤  things in these views.And we think there's no need to question these beliefs.  But when you ask yourself""Why are these beliefs right?""  The only answer you can give yourself may just be""Because they are just right.""  And where is the logic in all of this?  That's why now I choose to respect a person even if our views are totally different.  Because,ultimately,I cannot be sure that what I think is right.  Better let result be the judge.","['0', '0', '0', '0', '0', '1', '0', '0', '0', '0', '1', '0', '0', '0', '0', '0', '0', '0', '0']",0,0,0,0,0,1,0,0,0,0,1,0,0,0,0,0,0,0,0
308,"  Cherish the present, to live happily      It was a summer day.And old man strolled   ①  on a hill cheerfully.   He wiped the perspiration    ②   on his forehead with his sleeve and kept humming melodies    ③   to entertain himself.  Suddenly,he heard someone talking to him.  ""Hello,sir.""  The old man turned around but saw no one.  ""I'm here.""  The voice came from beside his feet.The old man looked down and saw a beautiful lily.  ""Sir,can I ask you a question?""asked the lily.  ""Sure,my child.What do you want to know?""said the old man.  The lily hesitated   ④  for a second and said:""Why are you so happy?You don't seem to have many days left to live.""  ""My days have passed and I'm about to wither   ⑤  .That makes me so sad.""the lily didn't wait for the old man to answer,she just kept going on.  The old man laughed.  ""Yes,I don't have many days left.But,so what?""  ""Why ruin such a lovely day for something that hasn't happen?""   ""What's gone is gone.What's to come is to come.You can't change them.But you can decide to enjoy this very moment that you truly have.""  And he didn't wait for the lily to respond.He just walked away,continuing the melody he had been humming.","['1', '0', '0', '0', '0', '1', '0', '0', '0', '0', '1', '0', '0', '0', '0', '0', '0', '0', '0']",1,0,0,0,0,1,0,0,0,0,1,0,0,0,0,0,0,0,0
309,"  Reading      We can get information by TV, by reading newspapers, magazines, books.  We start reading since an early age. We first read stories for kids, fairy tales   ①  that are good examples in order to decide what is good and wrong. Somehow books have educated us since our childhood.  As we grow up we keep on reading. Every book has to be read at a certain age. This is the way it can exercise our brain. We know that our imagination is improved by the information our brain gets.  If we do everyday exercise to keep our body healthy, we must read books and medicine articles. It is important to exercise both our body and our mind.  By reading we can make our own ideas about what is happening around us. The ideas we have, work  hand in hand with our imagination. This is how we can reveal our own opinions. We can make our own decisions regarding   ②  our life.  Reading is ""responsible"" of creating opinions and perspectives   ③  . If we get information we have to show it to the others. We have to use a high developed vocabulary and we only can acquire   ④  it by reading. We improve our talking only by reading and we know how important is that to the ""audience"". The more information we get, the more self confidence   ⑤  we have.  The attitude is the most important in a speech. If you want people to listen to what you have to say, you have to make them feel they are dominated   ⑥  by your attitude.  By reading we can only get useful things. So don't be afraid to read. It couldn't do you any harm!","['0', '1', '0', '0', '1', '0', '0', '0', '0', '0', '0', '0', '0', '0', '0', '0', '0', '0', '0']",0,1,0,0,1,0,0,0,0,0,0,0,0,0,0,0,0,0,0
310,"  Marlin Perkins'  I  nterest      Marlin Perkins' keen interest in animals, especially snakes, brought him a lot of trouble when he was young. His landlady never excused him for keeping snakes in his closet   ①  . After two years of college, he left school and found a job in a zoo, sweeping the sidewalks for $3.50 a day. He was very happy about it because he could now watch animals and study them all day long.He soon became an official in charge of reptiles   ②  and then director of the Buffalo Zoo.   Through his snake-hunting expeditions    ，    Perkins won his fame as a snake expert.His love for snakes is such that he thinks of them in terms of    ③   personalities.  However   ，   snakes do not have the universal appeal   ④  as he wishes.Even Perkins'most favorite animal Bushman   ，   the 550 pound toughest African ape   ⑤   ，  was frightened by snakes.Bushman once escaped from his cage.  Nothing could draw him back.Finally a keeper went to the reptile house   ，   got three little snakes   ，   and dangled   ⑥  them toward Bushman.The great ape nearly tore the place apart going back to the safety of his cage.  Perkins likes all animals and takes more interest in them than many parents take in their own children.He keeps daily records on all the baby animals   ，   takes their temperature and watches their diet strictly.   Speaking about his success    ，    Perkins sums up    ⑦   his philosophy    ⑧   of life as follows:“My life has taught me that the surest path to success is to find out what you most enjoy doing    ，    then set out to do it.”","['0', '1', '1', '0', '1', '0', '0', '0', '0', '0', '0', '0', '0', '0', '0', '0', '1', '1', '0']",0,1,1,0,1,0,0,0,0,0,0,0,0,0,0,0,1,1,0
311,"   Life is the coffee      A group of graduates got together to visit their old university professor.  The conversation soon turned into complaints   ①  about stress   ②  in work and life.Offering his guests coffee,the professor went to the kitchen and returned with a large pot of coffee and a variety of  cups—porcelain   ③  ,plastic,glass,crystal   ④  ,some  plain-looking,some expensive,some exquisite   ⑤  —telling them to help themselves to the coffee.  When all the students had a cup of coffee in hand,the professor said,  ""If you have noticed,all the nice-looking expensive cups have been taken up,leaving behind the plain and cheap ones.While it is normal for you to want only the best for yourselves,that is the source of your problems and stress.""  ""Be assured that the cup itself adds no quality to the coffee.In most cases it is just more expensive and in some cases even hides what we drink.""  ""   What all of you really want is coffee,not the cup,but you consciously went for the best cups...And then you began eyeing each other's cups.  ”  ""Now consider this:   Life is the coffee;the jobs,money and position in society are the cups.They are just tools to hold and contain life,and the type of cup we have does not define    ⑥   ,nor change the quality of life we live.Sometimes,by concentrating only on the cup,we fail to enjoy the coffee.  Savor the coffee,not the cups!Don't let the cups drive you...enjoy the coffee instead.""  This means you will find it easier to decide when you work and from where,as there are less barriers   ⑦  in your way over shifting   ⑧  your work pattern around to suit.","['1', '0', '1', '0', '1', '1', '0', '0', '0', '0', '1', '0', '1', '0', '0', '0', '1', '1', '0']",1,0,1,0,1,1,0,0,0,0,1,0,1,0,0,0,1,1,0
