,content,essay_label_id,Daily_life,Health_and_lifestyle,Selfawareness_and_Improvement,Language_Learning,Career_planning,Communication,Literature,Art,Sports,Traditional_custom,Hot_topic,History_Politics_Culture,Social_Progress_and_Human_Civilization,Technology_and_Invention,National_Geography,Natural_Environment_and_Heritage_Protection,Human_Environment_Animals_Plants,Human_Society_and_Environment,Cultural_heritage
90,"   A car key      A young man was getting ready to graduate from college. For many months he had admired a beautiful sports car in a dealer's showroom  ,  and knowing his father could well afford it  ,  he told him that was all he wanted.   As Graduation Day approached   ,   the young man awaited signs that his father had purchased the car.  Finally  ,  on the morning of his graduation  ,  his father called him into his private study. His father told him how proud he was to have such a fine son  ,  and told him how much he loved him. He handed his son a beautiful wrapped gift box.   Curious   ,   but somewhat disappointed   ,   the young man opened the box and found a lovely   ,   leather-bound Bible   ,   with the young man's name embossed    ①   in gold.  Angrily  ,  he raised his voice to his father and said  ,  ""With all your money you give me a Bible?"" He then stormed out of the house  ,  leaving the Bible.  Many years passed and the young man was very successful in business. He had a beautiful home and a wonderful family  ,  but realizing his father was very old  ,  he thought perhaps he should go to see him. He had not seen him since that graduation day. Before he could make the arrangements  ,  he received a telegram telling him his father had passed away  ,  and willed   ②  all of his possessions to his son. He needed to come home immediately and take care of things.  When he arrived at his father's house  ,  sudden sadness and regret filled his heart. He began to search through his father's important papers and saw the still new Bible  ,  just as he had left it years ago. With tears  ,  he opened the Bible and began to turn the pages. As he was reading  ,  a car key dropped from the back of the Bible. It had a tag   ③  with the dealer's name  ,  the same dealer who had the sports car he had desired. On the tag was the date of his graduation  ,  and the words... ""PAID IN FULL"".  How many times do we miss blessings because they are not packaged as we expected?   Do not spoil what you have by desiring what you have not; but remember that what you now have was once among the things you only hoped for.  Sometimes we don't realize the good fortune we have or we could have because we expect ""the packaging"" to be different.   What may appear as bad fortune may in fact be the door that is just waiting to be opened.","['1', '0', '1', '0', '1', '1', '0', '0', '0', '0', '0', '0', '1', '0', '0', '0', '0', '0', '0']",1,0,1,0,1,1,0,0,0,0,0,0,1,0,0,0,0,0,0
91,"    The Splashes of Life      My grandfather took me to the fish pond on the farm when I was about seven, and he told me to throw a stone   ①  into the water. He told me to watch the circles created by the stone. Then he asked me to think of myself as that stone.   ""You may create lots of splashes    ②   in your life, but the waves that come from those splashes will disturb the peace of all your fellow creatures,"" he said.  ""Remember that you are responsible for what you put in your circle and that circle will also touch many other circles.""  ""You will need to live in a way that allows the good that comes from your circle to send the peace of that goodness to others. The splash that comes from anger or jealousy will send those feelings to other circles. You are responsible for both.""  That was the first time I realized that each person creates the inner peace or discord   ③  that flows out into the world.   We cannot create world peace if we are riddled    ④   with inner conflict, hatred    ⑤   , doubt, or anger.  We radiate   ⑥  the feelings and thoughts that we hold inside, whether we speak them or not.   Whatever is splashing around inside of us is spilling    ⑦   out into the world, creating beauty or discord    ⑧   with all other circles of life.  stone  n.   石头；结石；   [   宝   ]   宝石   adj.   石的，石制的   vt.   向扔石块；用石头铺  s  plash  vt.   溅，泼；用   ...   使液体飞溅   n.   飞溅的水；污点；卖弄   vi.   溅湿；溅开  discord  n.   不和；不调和；嘈杂声   vi.   不一致；刺耳  riddled  adj.   充斥的；泛滥的   v.   解谜；出谜题（   riddle   的过去分词形式）  hatred  n.   憎恨；怨恨；敌意  r  adiate  vt.   辐射；传播；流露；发射；广播   vi.   辐射；流露；发光；从中心向各方伸展   adj.   辐射状的，有射线的  spilling  v.   溢漏，泄漏（   spill   的现在分词）；跌下   n.   溢出物；散落  discord  n.   不和；不调和；嘈杂声   vi.   不一致；刺耳","['0', '0', '1', '0', '0', '0', '0', '0', '0', '0', '0', '0', '0', '0', '0', '0', '0', '0', '0']",0,0,1,0,0,0,0,0,0,0,0,0,0,0,0,0,0,0,0
92,"   Change Makes Life Beautiful      To regard all things and principles of things as inconstant modes or fashions has more and more become the tendency of modern thought. Let us begin with that which is without-our physical life. Fix upon it in one of its more exquisite intervals, the moment, for instance, of delicious recoil from the flood of water in summer heat.  What is the whole physical life in that moment but a combination of natural elements to which science gives their names? But these elements, phosphorus  ①  and lime and delicate fibers, are present not in the human body alone: we detect them in places most remote from it. Our physical life is a perpetual motion of them ---the passage of the blood, the wasting and repairing of the lenses  ②  of the eye, the modification of the tissues of the brain under every ray of light and sound---processes which science reduces to simpler and more elementary forces.   Like the elements of which we are composed, the action of these forces extends beyond us: it rusts iron and ripens corn.  Far out on every side of us those elements are broadcast, driven in many currents; and birth and gesture and death and the springing of violets from the grave are but a few out of ten thousand resultant combinations.   That clear, perpetual outline of face and limb is but an image of ours, under which we group theme design in a web, the actual threads of which pass out beyond it.  This at least of flame---like our life has, that it is but the concurrence, renewed from moment to moment, of forces parting sooner or later on their ways.","['1', '0', '0', '0', '0', '0', '0', '0', '0', '0', '0', '0', '0', '0', '0', '0', '0', '0', '0']",1,0,0,0,0,0,0,0,0,0,0,0,0,0,0,0,0,0,0
93,"   The Man and the Opportunity       The lack of opportunity is ever the excuse of a weak,vacillating    ①   mind. Opportunities! Every life is full of them.  Every lesson in school or college is an opportunity.Every examination is a chance in life. Every business transaction   ②  is an opportunity-an opportunity to be polite, an opportunity to be  manly   ③   ，  an opportunity to be honest, an opportunity to make friends. Every proof of confidence in you is a great opportunity.  Every responsibility thrust   ④  upon your strength and your honor is priceless.   Existence is the privilege of effort, and when that privilege is met like a man, opportunities to succeed along the line of your aptitude    ⑤   will come faster than you can use them.  Young men and women, why do you stand here all the day idle   ⑥  ? Was the land all occupied before you were born? Has the earth ceased   ⑦  to yield its increase? Are the seats all taken? The positions all filled? The chances all gone? Are the resources of your country fully developed? Are the secrets of nature all mastered? Is there no way in which you can utilize   ⑧  these passing moments to improve yourself or benefit another?  Don't wait for your opportunity. Make it, make it as Napoleon made his in a hundred ""impossible"" situations. Make it, as all leaders of men, in war and in peace, have made their chances of success.   Make it, as every man must,who would accomplish anything worth the effort. Golden opportunities are nothing to laziness, but industry makes the commonest chances golden.","['0', '0', '1', '0', '1', '0', '0', '0', '0', '0', '1', '0', '0', '0', '0', '0', '0', '0', '0']",0,0,1,0,1,0,0,0,0,0,1,0,0,0,0,0,0,0,0
94,"   A Creed to Live By       Don't undermine your worth by comparing yourself with others. It is because we are different that each of us is special.  Don't set your goals by what other people deem   ①  important. Only you know what is best for you.  Don't take for granted the things closest to your heart.Cling to   ②  them as you would your life, for without them life is meaningless.  Don't let your life slip through   ③  your fingers by living in the past or the future. By living your life one day at a time, you live all the days of your life.   Don't give up when you still have something to give.Nothing is really over until the moment you stop trying.  Don't he afraid to admit that you are less than perfect.It is this fragile thread that binds   ④  us to each other.  Don't be afraid to encounter risks. It is by taking chances that we learn how to he brave.  Don't shut love out of your life by saying it's impossible to find. The quickest way to receive love is to give love; the fastest way to lose is to hold it too tightly; and the best way to keep love is to give it wings.  Don't dismiss your dreams. To be without dreams is to be without hope; to be without hope is to be without purpose.   Don't run through life so fast that you forget not only where you've been, but also where you're going. Life is not a race, but a journey to be savored    ⑤   each step of the way.","['1', '1', '1', '0', '1', '1', '0', '0', '0', '0', '0', '0', '0', '0', '0', '0', '1', '1', '0']",1,1,1,0,1,1,0,0,0,0,0,0,0,0,0,0,1,1,0
95,"   How to reduce work stress      Depending on the root cause  ,  some stressful situations unfold over long periods of time–a few days  ,  a couple weeks  ,  even the better part of a year.  If you work for a company that’s struggling to survive  ,  you may see no end in sight to the high-pressure environment you’re working within.  In cases like these  ,  you need to find ways to escape at least for a while.   Unfortunately   ,   many people’s first reaction is to do the reverse    ①   –cutting back on personal time in order to slog    ②   through a tough situation.  Remember  ,  stress isn’t just a response to what’s already going on around you–it’s also your reaction to negative things that might happen but haven’t yet.  So it’s important not to sacrifice the habits and routines that sustain you over the long haul   ③  .  And somewhat counterintuitively   ④  ,  one solution is to do things that lessen work-related stress in the near-term.  Yoga and mindfulness exercises are common ways to create a sense of peace and serenity   ⑤  .   No   ,   they won’t eliminate    ⑥   your dread    ⑦   of what might still be on the horizon   ,   but they can dampen    ⑧   the arousal    ⑨   that’s getting the best of you right now.  The other alternative is just to find something truly enjoyable to do  ,  whether or not it induces   ⑩  calm or mindfulness.  Go to a movie or concert. Play a game. Do some exercise.   In this case   ,   you’re focusing your motivation on something desirable   ,   rather than something stressful.  The motivation to do pleasant things competes with the motivation to avoid negative ones.  So if you can immerse   ⑪  yourself in positive activities  ,  you’ll shift your motivation away from the focus on the stressors   ⑫  for a while.  This can at le  a  st help you keep stress that you can’t totally eliminate at manageable levels over long periods.","['1', '0', '1', '0', '0', '0', '0', '0', '0', '0', '1', '0', '1', '0', '0', '0', '1', '1', '0']",1,0,1,0,0,0,0,0,0,0,1,0,1,0,0,0,1,1,0
96,"   The Instinct for the Beautiful      A child's world is fresh and new and beautiful, full of wonder and excitement. It is our misfortune that for most of us that clear-eyed vision, that true instinct of what is beautiful and awe-inspiring, is dimmed or even lost before we reach adulthood. If I had influence with the good fairy who is supposed to preside over the christening   ①  of all children I should ask that her gift to each child in the world be a sense of wonder so indestructible that it would last throughout life, as an unfailing antidote against the boredom and disenchantments   ②  of later years, the sterile preoccupation with things that are artificial, the alienation from the sources of our strength.   If a child is to keep alive his inborn sense of wonder without any such gift from the fairies, he needs the companionship of at least one adult who can share it, rediscovering with him the joy, excitement of mystery of the world we live in.  Parents often have a sense of inadequacy when confronted on the hand with eager, sensitive child mind of a child and on the other with a world of complex physical nature, inhabited by a life so various and unfamiliar that it seems hopeless to reduce it to order and knowledge. In a mood of self-defeat, they exclaim, ""How can I possibly teach my child about nature - why, I don't even know one bird from another!""  I sincerely believe that for the child, and for the parent seeking to guide them, it is not half so important to know as to feel. If facts are the seeds that later produce knowledge and wisdom, then the emotions and the impressions of the senses are the fertile soil in which the seeds must grow. The years of early childhood are the time to prepare the soil.   Once the emotions have been aroused - a sense of the beautiful, the excitement of the new and the unknown, a feeling of sympathy, pity, admiration or love - then we wish for knowledge about the object of our emotional response.  Once found, it has lasting meaning. It is more important to pave the way for the child to want to know than to put him on a diet of facts he is not ready to assimilate   ③  .   I am sure there is something much deeper, something lasting and significant.  Those who dwell, as scientists or laypeople, among the beauties and mysteries of the earth are never alone or weary of life. Whatever the problems or concerns of their personal lives, their thoughts can find paths that lead to inner satisfaction and to renewed excitement in living. Those who contemplate   ④  the beauty of the earth find reserves of strength that will endure as long as life lasts. There is symbolic as well as actual beauty in the migration of the birds, the ebb and flow of the tides, the folded bud ready for the spring. There is something infinitely healing in the repeated refrains of nature — the assurance that dawn comes after night, and spring after the winter.","['1', '0', '0', '0', '0', '0', '0', '0', '0', '0', '0', '0', '0', '0', '0', '0', '0', '0', '0']",1,0,0,0,0,0,0,0,0,0,0,0,0,0,0,0,0,0,0
97,"  To give love is to receive love       Several years ago, I was deploying    ①   overseas so I decided to leave my black cat Larry with my mother.  It was hard. Because I love my cat so much. I couldn't imagine living without him.  But I had to do that.  Plus, my mother had been feeling alone lately, and I hoped he would change that.  Those days were difficult, because Larry was already like a son to me.   I asked mother to share video of Larry online as frequently as possible    ②   .  After two years, I was ready to get him back.  Before I could do that, I got a call from my mother.  She said she had fallen asleep earlier and woke up to him on her chest, meowing   ③  and pushing her face.  He had never done that before.  She smelled something funny, jumped out of bed, and found the kitchen on fire.  Oh God, my mom is alive because of Larry. He had been protecting us in his way. He really sees us as his family.  I guess this is what love is.   It doesn't matter whether you are a human or a cat.  You give love and you get love.  And I know that Larry loves us, just like we love him.  Oh, by the way, he’s my mother's now. She just couldn't leave Larry after that.  And I'm totally OK with it.","['1', '0', '1', '0', '0', '0', '0', '0', '0', '0', '0', '0', '0', '0', '0', '0', '1', '1', '0']",1,0,1,0,0,0,0,0,0,0,0,0,0,0,0,0,1,1,0
98,"   Always Aim Higher      Always aim higher than you believe you can reach. So often, you'll discover that when your talents   ①  are set free by your imagination   ②  , you can achieve any goal.  If people offer their help or wisdom   ③  as you go through life, accept it gratefully   ④  . You can learn much from those who have gone before you.   But never be afraid or hesitant    ⑤   to step off the accepted path and head off    ⑥   in your own direction if your heart tells you that it's the right way for you.   Always believe that you will ultimately    ⑦   succeed at whatever you do, and never forget the value of persistence    ⑧   , discipline    ⑨   , and determination.  You are meant to be whatever you dream of becoming.","['1', '0', '1', '0', '1', '0', '0', '0', '0', '0', '0', '0', '0', '0', '0', '0', '0', '0', '0']",1,0,1,0,1,0,0,0,0,0,0,0,0,0,0,0,0,0,0
99,"   Choose Optimism       Optimism and pessimism are both powerful forces    ，   and each of us must choose which we want to shape our outlook and our expectations.  There is enough good and bad in everyone's life-ample   ①  sorrow and happiness,sufficient joy and pain-to find a rational   ②  basis for either optimism or pessimism. We can choose to laugh or cry, bless or curse   ③  .It's our decision: From which perspective do we want to view life? Will we look up in hope or down in despair?   An optimistic attitude is not a luxury;it's a necessity.The way you look at life will determine how you feel,how you perform, and how well you will get along with other people.  Conversely   ④  ,negative thoughts, attitudes,and expectations feed on themselves; they become a self-fulfilling prophecy   ⑤  .Pessimism creates a dismal   ⑥  place where no one wants to live.  Optimism diverts   ⑦  our attention away from negativism and channels it into positive, constructive thinking.   When you're an optimist, you're more concerned with problem-solving than with useless carping    ⑧   about issues.  In fact, without optimist, issues as big and ongoing as poverty have no hope of solution. It takes a dreamer-someone with hopelessly optimistic ideas, great persistence, and unlimited confidence-to tackle a problem that big. It's your choice.","['1', '1', '1', '0', '1', '1', '0', '0', '0', '0', '0', '0', '0', '0', '0', '0', '1', '1', '0']",1,1,1,0,1,1,0,0,0,0,0,0,0,0,0,0,1,1,0
100,"   Beauty of July      One has the leisure of July for perceiving all the differences of the green of leaves.   It is no longer a difference in degrees of maturity, for all the trees have darkened to their final tone, and stand in their differences of character and not of mere date.  Almost all the green is grave, not sad and not dull. It has a darkened and a daily colour, in majestic but not obvious harmony with dark grey skies, and might look, to inconstant eyes, as prosaic after spring as eleven o'clock looks after the dawn.  Gravity is the word---not solemnity as towards evening, nor menace   ①  as at night. The daylight trees of July are signs of common beauty, common freshness, and a mystery familiar and abiding as night and day. In childhood we all have a more exalted sense of dawn and summer sunrise than we ever fully retain or quite recover; and also a far-higher sensibility for April and April evenings---a heartache for them, which in riper years is gradually and irretrievably   ②  consoled.   But, on the other hand, childhood has so quickly learned to find daily things tedious, and familiar things importunate    ③   , that it has no great delight in the mere middle of the day, and feels weariness of the summer that has ceased to change visibly.  The poetry of mere day and of late summer becomes perceptible to mature eyes that have long ceased to be sated, have taken leave of weariness, and cannot now find anything in nature too familiar; eyes which have, indeed, lost sight of the further awe of midsummer daybreak, and no longer see so much of the past in April twilight   ④  as they saw when they had no past; but which look freshly at the dailiness of green summer, of early afternoon, of every sky of any form that comes to pass, and of the darkened elms   ⑤  .","['0', '0', '0', '0', '0', '0', '0', '0', '0', '0', '0', '0', '0', '0', '0', '1', '0', '0', '0']",0,0,0,0,0,0,0,0,0,0,0,0,0,0,0,1,0,0,0
101,"   Live a meaningful life      Realize that you have options.   There are places even here in the US where people don't have the option of being out of survival    ①   mode enough to ponder    ②   these issues.  If I were you, this is what I’d do: I’d pack a backpack and start traveling for up to a year.  The beauty of traveling is that, with little effort, it will take you out of your head-new currencies, new foods, new accents and people so you HAVE to pay more attention to everyday things.  Whether abroad or in the US, I’d suggest you do some volunteer   ③  work. When you don’t know what to do for yourself, go do something for another person(or for animals, the environment, etc…).   Besides traveling and volunteering, something else that’s great for when you don’t give a hoot is to read.  Read just for reading sake! Not to make you a better person, to get ahead, to pass the time, to be productive. Just find anything or anyone that interests you and read about it.  Remember you are not the one feeling this sense of helplessness.  It's ok to fail. I know how bad you feel now. You worked so hard to get into your dream school and you didn't get admitted in the end. It just didn't make any sense. Just let all these emotions out. Cry it out. And let it go.  You are not alone. There are people around you who cares about you. Your parents, friends, siblings   ④  . They were always there. Go talk to them and tell them how you feel.  Life is meaningful. Stop whatever you are doing and think about your life. What is important to you? What makes you happy? Or what makes you particularly sad? These are a few places you can start.  Life's beautiful.   It may seem like life’s unfair because you didn't get you wanted after giving up so much.  But these failures and setbacks will renew your perspective   ⑤  in life. You realise you didn't really need whatever you're working so hard for. You start to cherish   ⑥  the people and the things around you. Endure the darkness because it shows you the stars.","['1', '1', '1', '0', '0', '1', '0', '0', '0', '0', '0', '0', '0', '0', '0', '0', '1', '1', '0']",1,1,1,0,0,1,0,0,0,0,0,0,0,0,0,0,1,1,0
102," The Rabbits Who Caused All the Trouble      Within the memory of the youngest child there was a family of rabbits who lived near a pack of   ①  wolves. The wolves announced that they did not like the way the rabbits were living. (The wolves were crazy about the way they themselves were living, because it was the only way to live.) One night several wolves were killed in an earthquake and this was blamed   ②  on the rabbits, for it is well known that rabbits pound   ③  on the ground with their hind legs and cause earthquakes. On another night one of the wolves was killed by a bolt of lightning and this was also blamed on the rabbits, for it is well known that lettuce-eaters cause lightning. The wolves threatened to civilize   ④  the rabbits if they didn't behave, and the rabbits decided to run away to a desert island.   But the other animals, who lived at a great distance, shamed them, saying, ""You must stay where you are and be brave. This is no world for escapists    ⑤   .  If the wolves attack you, we will come to your aid, in all probability."" So the rabbits continued to live near the wolves and one day there was a terrible flood which drowned   ⑥  a great many wolves. This was blamed on the rabbits, for it is well known that carrot-nibblers with long ears cause floods. The wolves descended   ⑦  on the rabbits, for their own good, and imprisoned   ⑧  them in a dark cave, for their own protection.  When nothing was heard about the rabbits for some weeks, the other animals demanded to know what had happened to them. The wolves replied that the rabbits had been eaten and since they had been eaten the affair was a purely   ⑨  internal   ⑩  matter. But the other a animals warned that they might possibly unite against the wolves unless some reason was given for the destruction of rabbits. So the wolves gave them one.  ""They were trying to escape,"" said the wolves, ""and, as you know, this is no world for escapists.""","['0', '0', '1', '0', '0', '1', '0', '0', '0', '0', '0', '0', '0', '0', '0', '0', '0', '0', '0']",0,0,1,0,0,1,0,0,0,0,0,0,0,0,0,0,0,0,0
